<?xml version="1.0" encoding="UTF-8"?>
<!DOCTYPE section SYSTEM "../../../structure/sectionXmlDefn.dtd">
<section name="En comparant plusieurs moyensmeans">


<page dir="fr/multiGroup" filePrefix="multiGroup1">Pour comparer les moyens de plusieurs groupes, un modèle de distributions normales dans tous les groupes est utilisé, mais tous les écarts-types de groupe doit être supposé être le même.</page>
<page dir="fr/multiGroup" filePrefix="multiGroup2">Les écarts-types de l'échantillon dans les groupes distincts peuvent être combinés pour donner une estimation globale de l'écart-type commun, σ.</page>
<page dir="fr/multiGroup" filePrefix="multiGroup3" note="(optional)">Intervalles de confiance et des tests d'hypothèses antérieures pour l'égalité des deux moyens de groupe peuvent être améliorées lorsque les écarts-types de groupe sont connus pour être les mêmes. Cependant ce raffinement est pas recommandé pour une utilisation générale.</page>
<page dir="fr/multiGroup" filePrefix="multiGroup4">La variabilité entre les moyennes de groupe et de la variabilité au sein des groupes doit être utilisé pour évaluer si les groupes diffèrent.</page>
<page dir="fr/multiGroup" filePrefix="multiGroup5">La variabilité au sein des groupes et entre les groupes sont décrits par des sommes de carrés.</page>
<page dir="fr/multiGroup" filePrefix="multiGroup6">Le coefficient de détermination (R²) est le rapport entre les groupes et les sommes totales des carrés. Il est de la proportion de variation qui peut être expliqué par des différences entre les groupes.</page>
<page dir="fr/multiGroup" filePrefix="multiGroup7">Le F-ratio est une statistique de test qui est basé sur l'inter- et intra-groupes des sommes de carrés. Les tests p-valeur associées si tous les groupes ont la même moyenne.</page>
<page dir="fr/multiGroup" filePrefix="multiGroup8">Le test F est appliqué à un petit nombre d'ensembles de données.</page>

</section>
