<?xml version="1.0" encoding="UTF-8"?>
<!DOCTYPE section SYSTEM "../../../structure/sectionXmlDefn.dtd">
<section name="Médiane, quartiles et boîtes à moustaches">
<topText><![CDATA[
	<p>Box parcelles très résument la distribution des valeurs dans un ensemble de données. Ils sont utiles pour comparer différents lots de valeurs.</p>
]]></topText>


<page dir="fr/boxPlot" filePrefix="boxPlot1" summaryDir="en/boxPlot" summaryFilePrefix="s_boxPlot1" videoDir="en/boxPlot" videoFilePrefix="v_boxPlot1">Dot parcelles, la tige et les parcelles des feuilles et des histogrammes contiennent des informations détaillées qui est distrait lorsque deux ou plusieurs ensembles de données sont comparées.</page>
<page dir="fr/boxPlot" filePrefix="boxPlot2" summaryDir="en/boxPlot" summaryFilePrefix="s_boxPlot2" videoDir="en/boxPlot" videoFilePrefix="v_boxPlot2">La médiane et les quartiles répartissent un lot de valeurs en quatre ensembles de taille égale de valeurs. Une boîte à moustaches est un affichage graphique de la médiane, quartiles et extrêmes.</page>
<page dir="fr/boxPlot" filePrefix="boxPlot3" summaryDir="en/boxPlot" summaryFilePrefix="s_boxPlot3" videoDir="en/boxPlot" videoFilePrefix="v_boxPlot3">Une boîte à moustaches montre clairement le centre, la propagation et l'asymétrie d'un ensemble de données. Il divise l'histogramme correspondant en 4 zones approximativement égales.</page>
<page dir="fr/boxPlot" filePrefix="boxPlot4" summaryDir="en/boxPlot" summaryFilePrefix="s_boxPlot4" videoDir="en/boxPlot" videoFilePrefix="v_boxPlot4">L'intrigue de la boîte de base est souvent modifié pour afficher les valeurs aberrantes que des croix séparés.</page>
<page dir="fr/boxPlot" filePrefix="boxPlot5" summaryDir="en/boxPlot" summaryFilePrefix="s_boxPlot5" videoDir="en/boxPlot" videoFilePrefix="v_boxPlot5">Box parcelles ne peuvent pas montrer des grappes, de sorte ne doivent jamais être utilisé pour les données avec des clusters.</page>
<page dir="fr/boxPlot" filePrefix="boxPlot6" summaryDir="en/boxPlot" summaryFilePrefix="s_boxPlot6" videoDir="en/boxPlot" videoFilePrefix="v_boxPlot6">Box parcelles sont particulièrement efficaces pour l'affichage des différences entre plusieurs groupes de valeurs.</page>

</section>
