<?xml version="1.0" encoding="UTF-8"?>
<!DOCTYPE section SYSTEM "../../../structure/sectionXmlDefn.dtd">
<section name="Intervalle de confiance pour la moyenne">

<page dir="fr/ciMean" filePrefix="ciMean1">L'erreur d'estimation pour tout estimateur sans biais, a environ 0,95 probabilité d'être entre -2SE et + 2SE. Un intervalle de confiance approximatif de 95% pour le paramètre est donc l'estimation ± 2SE.</page>
<page dir="fr/ciMean" filePrefix="ciMean2">Si l'écart type de population est connue, l'erreur-type peut être déterminée précisément. Un intervalle de confiance de 95% est la moyenne de l'échantillon deux fois cette ±. (Ou plus exactement, 1,96 fois l'erreur-type.)</page>
<page dir="fr/ciMean" filePrefix="ciMean3">Une simulation montre que les intervalles de confiance à 95% sont aléatoires - elles varient d'un échantillon à. Environ 95% des échantillons donne des intervalles de confiance qui comprennent le véritable paramètre.</page>
<page dir="fr/ciMean" filePrefix="ciMean4">Dans la pratique, l'écart type de population est généralement inconnue. Si la population SD est simplement remplacée par son équivalent d'échantillon, l'estimation d'intervalle a un niveau de confiance inférieur à 95%.</page>
<page dir="fr/ciMean" filePrefix="ciMean5">Pour obtenir un niveau de confiance de 95%, une valeur t à partir de tables doit remplacer la constante 1,96.</page>
<page dir="fr/ciMean" filePrefix="ciMean6">Une simulation montre que les intervalles de 95% de confiance qui en résultent ont une probabilité de 0,95 d'inclure la moyenne de la population.</page>
<page dir="fr/ciMean" filePrefix="ciMean7">Quelques exemples des intervalles de confiance de 95% pour les moyens de population sont donnés et interprétés.</page>

</section>
