<?xml version="1.0" encoding="UTF-8"?>
<!DOCTYPE section SYSTEM "../../../structure/sectionXmlDefn.dtd">
<section name="Estimating parameters">


<page dir="en/regnEst" filePrefix="regnEst1" summaryDir="en/regnEst" summaryFilePrefix="s_regnEst1" videoDir="en/regnEst" videoFilePrefix="v_regnEst1">A least squares line provides estimates of the linear model's slope and intercept. These estimates are random values &amp;mdash; they vary from sample to sample.</page>
<page dir="en/regnEst" filePrefix="regnEst2" summaryDir="en/regnEst" summaryFilePrefix="s_regnEst2" videoDir="en/regnEst" videoFilePrefix="v_regnEst2">The third parameter of the normal linear model is the error standard deviation. It can be estimated using the residuals from the least squares line.</page>
<page dir="en/regnEst" filePrefix="regnEst3" summaryDir="en/regnEst" summaryFilePrefix="s_regnEst3" videoDir="en/regnEst" videoFilePrefix="v_regnEst3">The least squares estimate of the model's slope has a normal distribution that is centred on the true value.</page>
<page dir="en/regnEst" filePrefix="regnEst4" summaryDir="en/regnEst" summaryFilePrefix="s_regnEst4" videoDir="en/regnEst" videoFilePrefix="v_regnEst4">The distribution of the least squares slope may be estimated from a single data set.</page>
<page dir="en/regnEst" filePrefix="regnEst5" summaryDir="en/regnEst" summaryFilePrefix="s_regnEst5" videoDir="en/regnEst" videoFilePrefix="v_regnEst5">A confidence interval for the model's slope can be obtained from its least squares estimate and its standard error.</page>
<page dir="en/regnEst" filePrefix="regnEst6" summaryDir="en/regnEst" summaryFilePrefix="s_regnEst6" videoDir="en/regnEst" videoFilePrefix="v_regnEst6">Confidence intervals for the model's slope have the same properties as confidence intervals for population means or proportions.</page>
<page dir="en/regnEst" filePrefix="regnEst7" nameOverride="Influences on accuracy" note="Optional (not examined)#(opt)" summaryDir="en/regnEst" summaryFilePrefix="s_regnEst7" videoDir="en/regnEst" videoFilePrefix="v_regnEst7">The standard error of the least squares slope depends on the response standard deviation round the model line, the sample size and the standard deviation of X. Collecting data with a big spread of x-values gives more accurate estimates but there are disadvantages.</page>

</section>
