<?xml version="1.0" encoding="UTF-8"?>
<!DOCTYPE section SYSTEM "../../../structure/sectionXmlDefn.dtd">
<section name="Describing centre and spread">


<page dir="en/centerSpread" filePrefix="centerSpread_b2" summaryDir="en/centerSpread" summaryFilePrefix="s_centerSpread2" videoDir="en/centerSpread" videoFilePrefix="v_centerSpread_b2">The median is a summary of the centre of a distribution. The range and inter-quartile range both describe spread.</page>
<page dir="en/centerSpread" filePrefix="centerSpread_b3" summaryDir="en/centerSpread" summaryFilePrefix="s_centerSpread3" videoDir="en/centerSpread" videoFilePrefix="v_centerSpread_b3">The median and mean are alternative measures of the centre of a distribution.</page>
<page dir="en/centerSpread" filePrefix="centerSpread4" summaryDir="en/centerSpread" summaryFilePrefix="s_centerSpread4" videoDir="en/centerSpread" videoFilePrefix="v_centerSpread4">When a data set is not symmetric, the mean and median may differ substantially.</page>
<page dir="en/centerSpread" filePrefix="centerSpread5" summaryDir="en/centerSpread" summaryFilePrefix="s_centerSpread5" videoDir="en/centerSpread" videoFilePrefix="v_centerSpread5">The standard deviation is the most commonly used numerical summary of the spread of values in a data set.</page>
<page dir="en/centerSpread" filePrefix="centerSpread6" summaryDir="en/centerSpread" summaryFilePrefix="s_centerSpread6" videoDir="en/centerSpread" videoFilePrefix="v_centerSpread6">The 70-95-100 rule-of-thumb is useful for understanding the numerical value of the standard deviation.</page>

<page dir="en/centerSpread" filePrefix="centerSpread8" summaryDir="en/centerSpread" summaryFilePrefix="s_centerSpread8" videoDir="en/centerSpread" videoFilePrefix="v_centerSpread8">The mean and standard deviation cannot give any indication of the existance of outliers, skewness or clusters. A dot plot or histogram should be examined before reporting these numerical summaries.</page>

<page dir="en/moreVariation" filePrefix="moreVariation1" summaryDir="en/moreVariation" summaryFilePrefix="s_moreVariation1" videoDir="en/moreVariation" videoFilePrefix="v_moreVariation1">If a data set contains an outlier, the mean and especially the standard deviation can be badly affected. The values may be obviously wrong when the 70-95-100 rule is applied in the context of the data but examining a dot plot or box plot is best.</page>
</section>
