<?xml version="1.0" encoding="UTF-8"?>
<!DOCTYPE section SYSTEM "../../../structure/sectionXmlDefn.dtd">
<section name="Stichprobenverteilung von Häufigkeiten">
<topText><![CDATA[<p>Kategorielle Daten werden gewöhnlich durch Häufigkeiten zusammengefasst. Bei Stichproben sind diese Häufigkeiten Zufallsvariablen und unterliegen Wahrscheinlichkeitsverteilungen.</p>]]></topText>


<page dir="de/randomPropn" filePrefix="randomPropn1">Die Häufigkeit einer Kategorie in der Grundgesamtheit beschreibt ihre Wahrscheinlichkeit. Häufigkeiten und Wahrscheinlichkeiten können sowohl für metrische, als auch für kategorielle Variablen abgeleitet werden.</page>
<page dir="de/randomPropn" filePrefix="randomPropn2">Die Häufigkeit einer Kategorie in einer Stichprobe ist eine Statistik, die von Stichprobe zu Stichprobe schwanken kann. Die absolute Häufigkeit einer Kategorie in einer Stichprobe ist, genau wie die relative Häufigkeit, eine Zufallsvariable. Die absolute Häufigkeit folgt dabei einer diskreten Häufigkeitsverteilung.</page>
<page dir="de/randomPropn" filePrefix="randomPropn_b3">Die absolute Häufigkeit einer Kategorie in einer Stichprobe folgt gewöhlich einer Binomialverteilung mit den Parametern n und p.</page>
<page dir="de/randomPropn" filePrefix="randomPropn_b4">Die Binomialverteilung kann verwendet werden um Wahrscheinlichkeiten für absolute Häufigkeiten in einer Stichprobe zu ermitteln.</page>
<page dir="de/randomPropn" filePrefix="randomPropn5">Ist der Stichprobenumfang groß, dann nähert sich die Binomialverteilung der Normalverteilung an.</page>
<page dir="de/randomPropn" filePrefix="randomPropn_b6">Ist der Stichprobenumfang groß, dann kann die Normalverteilung verwendet werden, um binomiale Wahrscheinlichkieten zu ermitteln.</page>

</section>
