<?xml version="1.0" encoding="UTF-8"?>
<!DOCTYPE section SYSTEM "../../../structure/sectionXmlDefn.dtd">
<section name="Lage und Streuung beschreiben">

<page dir="de/centerSpread" filePrefix="centerSpread1">Das Zentrum einer Verteilung ist ein 'typischer Wert'. Die Streuung beschreibt, wie stark die Werte um das Zentrum streuen.</page>
<page dir="de/centerSpread" filePrefix="centerSpread2">Der Median ist ein Lagemaß. Variationsbreite und Interquartilsbreite sind Streuungsmaße.</page>
<page dir="de/centerSpread" filePrefix="centerSpread3">Der Median und das arithmetische Mittel sind beide Lagemaße.</page>
<page dir="de/centerSpread" filePrefix="centerSpread4">Sind Datensätze unsymmetrisch können sich der Median und das arithmetische Mittel deutlich unterscheiden.</page>
<page dir="de/centerSpread" filePrefix="centerSpread5">Die Streuung wird am häufigsten durch die Standardabweichung ausgedrückt.</page>
<page dir="de/centerSpread" filePrefix="centerSpread6">Die 70-95-100 Faustregel ist nützlich um die Standardabweichung interpretieren zu können.</page>
<page dir="de/centerSpread" filePrefix="centerSpread7">Aus einem Histogramm kann man grob das arithmetische Mittel und die Standardabweichung schätzen. </page>
<page dir="de/centerSpread" filePrefix="centerSpread8">Ein Dotplot oder Histogramm sollte erstellt werden, um Ausreisser, Schiefe und Cluster zu erkennen, da Standardabweichung und Mittelwert darüber keine Aussagen zulassen.</page>

</section>
