<?xml version="1.0" encoding="UTF-8"?>
<!DOCTYPE section SYSTEM "../../../structure/sectionXmlDefn.dtd">
<section name="Stichproben in der Praxis">
<topText><![CDATA[<p>In vielen praxisnahen Situationen gibt es bessere Methoden der Stichprobenerhebung, als die einfache zufällige Stichprobenziehung. Welche Methode man auch immer verwendet: Fehler, die nicht auf zufällige Schwankungen zurückzuführen sind, können einen extrem negativen Effekt auf das Ergebnis haben.</p>]]></topText>


<page dir="de/sampPractice" filePrefix="sampPractice_b1">Teilweise lassen sich bessere Schätzungen ermitteln, wenn die Zufallsstichproben innerhalb verschiedener Gruppen der Grundgesamtheit erhoben werden.</page>
<page dir="de/sampPractice" filePrefix="sampPractice2">Sind die Versuchseinheiten in sogenannten Klumpen (englisch Clusters) angeordnet, ist es häufig günstiger die Klumpen komplett zu untersuchen. Die zufällige Auswahl bezieht sich dann darauf, welche Klumpen aus der Grundgesamtheit zufällig gewählt werden.</page>
<page dir="de/sampPractice" filePrefix="sampPractice3">Ist die zu untersuchende Grundgesamtheit über ein weites Gebiet verteilt, dann kann es Sinn machen nur Stichproben in einigen Teilregionen zu erheben.</page>
<page dir="de/sampPractice" filePrefix="sampPractice4">Stichproben werden normalerweise erhoben, um bestimmte Charakteristiken einer Grundgesamtheit zu schätzen. Die Variation, die aus der Stichprobenziehung resultiert wird Stichprobenfehler genannt. Schwierigkeiten in der praktischen Umsetzung der Stichprobenerhebung können zu verzerrten Schätzungen führen (Bias).</page>
<page dir="de/sampPractice" filePrefix="sampPractice_b5">Bestimmte Arten von Fehlern bewirken, dass bestimmte Versuchobjekte nicht in die Stichprobe gelangen können.</page>
<page dir="de/sampPractice" filePrefix="sampPractice_b6">Interviewer-Fehler und Messfehler können zu falschen Messungen führen.</page>
<page dir="de/sampPractice" filePrefix="sampPractice7">Zum Design von Fragebögen gibt es eine Vielzahl von Mechanismen und Methoden. Alle haben jeweils ganz bestimmte Vor- und Nachteile.</page>

</section>
