<?xml version="1.0" encoding="UTF-8"?>
<!DOCTYPE section SYSTEM "../../../structure/sectionXmlDefn.dtd">
<section name="Descripción del centro y de la extensión">

<page dir="es/centerSpread" filePrefix="centerSpread_b1">El centro de una distribución es un &#8220;valor típico&#8221;. La extensión describe hasta dónde los valores son del centro.</page>
<page dir="es/centerSpread" filePrefix="centerSpread_b2">El punto medio es un resumen del centro de una distribución. La gama y la gama intercuartil ambas describen la extensión.</page>
<page dir="es/centerSpread" filePrefix="centerSpread_b3">El punto medio y el medio son medidas alternativas del centro de una distribución.</page>
<page dir="es/centerSpread" filePrefix="centerSpread4">Cuando un conjunto de datos no es simétrico, el malo y el punto medio pueden diferenciar substancialmente.</page>
<page dir="es/centerSpread" filePrefix="centerSpread5">La desviación estándar es el resumen numérico más de uso general de la extensión de valores en un conjunto de datos.</page>
<page dir="es/centerSpread" filePrefix="centerSpread6">La regla empírica 70-95-100 es útil para entender el valor numérico de la desviación estándar.</page>
<page dir="es/centerSpread" filePrefix="centerSpread7">Es posible conjeturar áspero la desviación mala y estándar de un histograma y bosquejar áspero un histograma simétrico que empareja cualquier desviación mala y estándar dada.</page>
<page dir="es/centerSpread" filePrefix="centerSpread8">La desviación mala y estándar no puede dar ninguna indicación de la existencia de afloramientos, de la oblicuidad o de racimos. Un diagrama o un histograma del punto debe ser examinado antes de divulgar estos resúmenes numéricos.</page>

</section>
