<?xml version="1.0" encoding="UTF-8"?>
<!DOCTYPE section SYSTEM "../../../structure/sectionXmlDefn.dtd">
<section name="Corr&amp;eacute;lation">
<topText><![CDATA[<p>Cette section d&eacute;crit une synth&egrave;se num&eacute;rique de la force de la relation entre deux variables, X et Y.</p>]]></topText>


<page dir="fr/correlation" filePrefix="correlation_b1">Une description num&amp;eacute;rique de la force d'une relation ne doit pas &amp;ecirc;tre affect&amp;eacute; par changement d'&amp;eacute;chelle des variables.</page>
<page dir="fr/correlation" filePrefix="correlation2">Standardiser une variable donne z-scores qui ne d&amp;eacute;pendent pas sur les unit&amp;eacute;s de la variable d'origine. (Le coefficient de corr&amp;eacute;lation sera d&amp;eacute;finie en termes de z-scores pour X et Y.)</page>
<page dir="fr/correlation" filePrefix="correlation3">Le coefficient de corr&amp;eacute;lation r&amp;eacute;sume la force de la relation entre X et Y. Il est +1 o&amp;ugrave; les croix nuage sont sur une ligne droite avec une pente positive, -1 quand sur une ligne avec une pente n&amp;eacute;gative et nulle lorsque X et Y sont ind&amp;eacute;pendantes.</page>
<page dir="fr/correlation" filePrefix="correlation4">Vous devriez &amp;ecirc;tre capable d'estimer la valeur de r en regardant un nuage de points et d'imaginer un nuage de croix correspondant &amp;agrave; une valeur de r.</page>
<page dir="fr/correlation" filePrefix="correlation5">Le coefficient de corr&amp;eacute;lation est seulement une bonne mesure de la force d'une relation, si les points dans un nuage de points sont dispers&amp;eacute;s autour d'une ligne droite, pas une courbe.</page>
<page dir="fr/correlation" filePrefix="correlation6">Le coefficient de corr&amp;eacute;lation ne peut pas identifier la courbure, les valeurs aberrantes ou des clusters et peut &amp;ecirc;tre trompeuse si ces caract&amp;eacute;ristiques sont pr&amp;eacute;sentes. Un diagramme de dispersion doit toujours &amp;ecirc;tre examin&amp;eacute; aussi.</page>

</section>
