<?xml version="1.0" encoding="UTF-8"?>
<!DOCTYPE section SYSTEM "../../../structure/sectionXmlDefn.dtd">
<section name="Indépendence">
<topText><![CDATA[<p>Les relations entre les variables catégorielles peuvent être décrits dans des termes similaires à ceux-ci utilisé pour des variables numériques.</p>]]></topText>


<page dir="fr/indep" filePrefix="indep1">Deux variables catégorielles, X et Y, sont associés lorsque la distribution conditionnelle de Y sachant X = x est différent pour différentes valeurs de x. Connaissant la valeur de X vous dit donc quelque chose sur Y.</page>
<page dir="fr/indep" filePrefix="indep2">Lorsque la distribution conditionnelle de Y est le même pour toutes les valeurs de X, les variables sont appelées indépendant. Ce cas particulier est d'une importance pratique.</page>
<page dir="fr/indep" filePrefix="indep3">L'indépendance est une propriété de la population. Pour évaluer l'indépendance d'une table échantillon d'urgence, le nombre de cellules observées sont comparées à celles estimées à partir d'un modèle à l'indépendance.</page>
<page dir="fr/indep" filePrefix="indep4">La somme brute de différences au carré entre le nombre de cellules observés et estimés est pas une bonne statistique de test.</page>
<page dir="fr/indep" filePrefix="indep5"> La statistique de chi-carré est une somme modifiée de différences au carré qui a une distribution standard (une distribution chi-carré) quand il est l'indépendance.</page>
<page dir="fr/indep" filePrefix="indep6">La statistique du chi-carré peut être utilisé pour trouver une p-valeur pour l'indépendance de test. La p-valeur n'a interprétation et propriétés similaires à p-valeurs pour tous les autres tests d'hypothèses.</page>
<page dir="fr/indep" filePrefix="indep7">Le test du chi-carré est appliqué à quelques ensembles de données réelles. Lorsque les variables sont révélés être associés, la nature de la relation est décrite à partir d'une comparaison entre le nombre de cellules observées et estimées.</page>
<page dir="fr/indep" filePrefix="indep8">Le test du chi carré évalue l'indépendance de deux variables catégoriques. Il est également utilisé pour tester si une variable catégorique a la même répartition en plusieurs groupes.</page>

</section>
