<?xml version="1.0" encoding="UTF-8"?>
<!DOCTYPE section SYSTEM "../../../structure/sectionXmlDefn.dtd">
<section name="Einführung in statistische Schätzverfahren">

<page dir="de/estIntro" filePrefix="estIntro_b1">Werden Daten erhoben, dann sind wir normalerweise an der unbekannten Grundgesamtheit interessiert, aus der die Daten erhoben wurden.</page>
<page dir="de/estIntro" filePrefix="estIntro_b2">Mit einigen wenigen zusammenfassenden Maßzahlen (Parametern) zur Verteilung der Grundgesamtheit können oft die wichtigsten Eigenschaften beschrieben werden. Die entsprechenden Maßzahlen der Stichprobe (Statistiken) dienen uns dafür als Schätzungen.</page>
<page dir="de/estIntro" filePrefix="estIntro3">Auf dieser Seite werden einige Beispiel gezeigt, bei den Stichprobenstatistiken zur Schätzung wichtiger Populationsparameter genutzt werden.</page>
<page dir="de/estIntro" filePrefix="estIntro4">Der Unterschied zwischen einem Parameter der Grundgesamtheit und einer Stichprobenstatistik wird als Stichprobenfehler bezeichnet.</page>
<page dir="de/estIntro" filePrefix="estIntro_b5">Stichprobenfehler variieren von Stichprobe zu Stichprobe und folgen einer Verteilung.</page>
<page dir="de/estIntro" filePrefix="estIntro6">Ein guter Schätzer hat einen Fehler, der nah an Null liegt. Im besten Fall ist die Fehlerverteilung auf Null zentriert (kein Bias) und hat eine kleine Standardabweichung (Standardfehler). Der Standardfehler ist die Standardabweichung sowohl des Schätzers, als auch des Stichprobenfehlers.</page>
<page dir="de/estIntro" filePrefix="estIntro7">Ein Intervallschätzer ist eine Spannbreite an Werten, bei der wir zuversichtlich sind, dass innerhalb deren Schranken der unbekannte Parameter der Grundgesamtheit liegt.</page>

</section>
